<?xml version="1.0"?>
<database xmlns="urn:yourfritz-de:YourFritz" xmlns:xsi="http://www.w3.org/2001/XMLSchema-instance" xsi:schemaLocation="urn:yourfritz-de:YourFritz feature_database.xsd">
  <devices>
    <model HWRevision="185" DeviceName="FRITZ!Box 7490" Architecture="MIPS" InstructionSet="MIPS34" Endianess="big" CPU="VR9" USBVersion="3" USBPorts="2" InternalNAS="406" RAM="256" SystemFlashType="SPI" FirmwareStructure="wrapped" KernelPartitionSize="4" FilesystemPartitionSize="48" SquashFSVersion="4" SquashFSCompression="xz" DualSystemCapable="yes" TFFSFormat="Legacy"/>
    <model HWRevision="213" DeviceName="FRITZ!Box Cable 6490" Architecture="ATOM" InstructionSet="i686" Endianess="little" CPU="Puma6" USBVersion="2" USBPorts="2" InternalNAS="1518" RAM="256" SystemFlashType="eMMC" FirmwareStructure="separated" KernelPartitionSize="8" FilesystemPartitionSize="64" SquashFSVersion="4" SquashFSCompression="xz" DualSystemCapable="yes" TFFSFormat="Legacy"/>
    <model HWRevision="156" DeviceName="FRITZ!Box 7390" Architecture="MIPS" InstructionSet="MIPS24" Endianess="big" CPU="Fusiv" USBVersion="2" USBPorts="2" InternalNAS="512" RAM="128" SystemFlashType="NOR" FirmwareStructure="combined" KernelPartitionSize="14" SquashFSVersion="3" SquashFSCompression="gzip" DualSystemCapable="no" TFFSFormat="Legacy"/>
    <model HWRevision="221" DeviceName="FRITZ!Box 7560" Architecture="MIPS" InstructionSet="MIPS34" Endianess="big" CPU="GRX5" USBVersion="2" USBPorts="1" InternalNAS="17" RAM="256" SystemFlashType="NAND" FirmwareStructure="separated" KernelPartitionSize="8" FilesystemPartitionSize="44" SquashFSVersion="4" SquashFSCompression="xz" DualSystemCapable="yes" TFFSFormat="NAND"/>
    <model HWRevision="225" DeviceName="FRITZ!Box 7580" Architecture="MIPS" InstructionSet="MIPS34" Endianess="big" CPU="GRX5" USBVersion="3" USBPorts="2" InternalNAS="355" RAM="512" SystemFlashType="NAND" FirmwareStructure="separated"  KernelPartitionSize="8" FilesystemPartitionSize="44" SquashFSVersion="4" SquashFSCompression="xz" DualSystemCapable="yes" TFFSFormat="NAND"/>
    <model HWRevision="226" DeviceName="FRITZ!Box 7590" Architecture="MIPS" InstructionSet="MIPS34" Endianess="big" CPU="GRX5" USBVersion="3" USBPorts="2" InternalNAS="355" RAM="512" SystemFlashType="NAND" FirmwareStructure="separated" KernelPartitionSize="8" FilesystemPartitionSize="44" SquashFSVersion="4" SquashFSCompression="xz" DualSystemCapable="yes" TFFSFormat="NAND"/>
    <model HWRevision="223" DeviceName="FRITZ!Box 5490" Architecture="MIPS" InstructionSet="MIPS34" Endianess="big" CPU="VR9" USBVersion="3" USBPorts="2" InternalNAS="406" RAM="256" SystemFlashType="SPI" FirmwareStructure="wrapped" KernelPartitionSize="4" FilesystemPartitionSize="48" SquashFSVersion="4" SquashFSCompression="xz" DualSystemCapable="yes" TFFSFormat="Legacy"/>
  </devices>
</database>
